{
  "schemaVersion": "1.0.0",
  "generatedAt": "2026-02-03",
  "source": "https://api.flutter.dev/flutter/material/",
  "components": [
    {
      "id": "aboutdialog",
      "name": "AboutDialog",
      "category": "A",
      "summary": "An about box. This is a dialog box with the application's icon, name, version number, and copyright, plus a button to show licenses for software used by the application.",
      "docUrl": "https://api.flutter.devmaterial/AboutDialog-class.html",
      "kind": "class"
    },
    {
      "id": "aboutlisttile",
      "name": "AboutListTile",
      "category": "A",
      "summary": "A ListTile that shows an about box.",
      "docUrl": "https://api.flutter.devmaterial/AboutListTile-class.html",
      "kind": "class"
    },
    {
      "id": "actionchip",
      "name": "ActionChip",
      "category": "A",
      "summary": "A Material Design action chip.",
      "docUrl": "https://api.flutter.devmaterial/ActionChip-class.html",
      "kind": "class"
    },
    {
      "id": "actionicontheme",
      "name": "ActionIconTheme",
      "category": "A",
      "summary": "An inherited widget that overrides the default icon of BackButtonIcon, CloseButtonIcon, DrawerButtonIcon, and EndDrawerButtonIcon in this widget's subtree.",
      "docUrl": "https://api.flutter.devmaterial/ActionIconTheme-class.html",
      "kind": "class"
    },
    {
      "id": "actioniconthemedata",
      "name": "ActionIconThemeData",
      "category": "A",
      "summary": "A ActionIconThemeData that overrides the default icons of BackButton, CloseButton, DrawerButton, and EndDrawerButton with ActionIconTheme.of or the overall Theme's ThemeData.actionIconTheme.",
      "docUrl": "https://api.flutter.devmaterial/ActionIconThemeData-class.html",
      "kind": "class"
    },
    {
      "id": "adaptation",
      "name": "Adaptation",
      "category": "A",
      "summary": "Defines a customized theme for components with an adaptive factory constructor.",
      "docUrl": "https://api.flutter.devmaterial/Adaptation-class.html",
      "kind": "class"
    },
    {
      "id": "adaptivetextselectiontoolbar",
      "name": "AdaptiveTextSelectionToolbar",
      "category": "A",
      "summary": "The default context menu for text selection for the current platform.",
      "docUrl": "https://api.flutter.devmaterial/AdaptiveTextSelectionToolbar-class.html",
      "kind": "class"
    },
    {
      "id": "alertdialog",
      "name": "AlertDialog",
      "category": "A",
      "summary": "A Material Design alert dialog.",
      "docUrl": "https://api.flutter.devmaterial/AlertDialog-class.html",
      "kind": "class"
    },
    {
      "id": "animatedicon",
      "name": "AnimatedIcon",
      "category": "A",
      "summary": "Shows an animated icon at a given animation progress.",
      "docUrl": "https://api.flutter.devmaterial/AnimatedIcon-class.html",
      "kind": "class"
    },
    {
      "id": "animatedicondata",
      "name": "AnimatedIconData",
      "category": "A",
      "summary": "Vector graphics data for icons used by AnimatedIcon.",
      "docUrl": "https://api.flutter.devmaterial/AnimatedIconData-class.html",
      "kind": "class"
    },
    {
      "id": "animatedicons",
      "name": "AnimatedIcons",
      "category": "A",
      "summary": "Identifier for the supported Material Design animated icons.",
      "docUrl": "https://api.flutter.devmaterial/AnimatedIcons-class.html",
      "kind": "class"
    },
    {
      "id": "animatedtheme",
      "name": "AnimatedTheme",
      "category": "A",
      "summary": "Animated version of Theme which automatically transitions the colors, etc, over a given duration whenever the given theme changes.",
      "docUrl": "https://api.flutter.devmaterial/AnimatedTheme-class.html",
      "kind": "class"
    },
    {
      "id": "appbar",
      "name": "AppBar",
      "category": "A",
      "summary": "A Material Design app bar.",
      "docUrl": "https://api.flutter.devmaterial/AppBar-class.html",
      "kind": "class"
    },
    {
      "id": "appbartheme",
      "name": "AppBarTheme",
      "category": "A",
      "summary": "Defines default property values for descendant AppBar widgets.",
      "docUrl": "https://api.flutter.devmaterial/AppBarTheme-class.html",
      "kind": "class"
    },
    {
      "id": "appbarthemedata",
      "name": "AppBarThemeData",
      "category": "A",
      "summary": "Defines default property values for descendant AppBar widgets.",
      "docUrl": "https://api.flutter.devmaterial/AppBarThemeData-class.html",
      "kind": "class"
    },
    {
      "id": "autocomplete",
      "name": "Autocomplete",
      "category": "A",
      "summary": "A widget for helping the user make a selection by entering some text and choosing from among a list of options.",
      "docUrl": "https://api.flutter.devmaterial/Autocomplete-class.html",
      "kind": "class"
    },
    {
      "id": "backbutton",
      "name": "BackButton",
      "category": "B",
      "summary": "A Material Design back icon button.",
      "docUrl": "https://api.flutter.devmaterial/BackButton-class.html",
      "kind": "class"
    },
    {
      "id": "backbuttonicon",
      "name": "BackButtonIcon",
      "category": "B",
      "summary": "A \"back\" icon that's appropriate for the current TargetPlatform.",
      "docUrl": "https://api.flutter.devmaterial/BackButtonIcon-class.html",
      "kind": "class"
    },
    {
      "id": "badge",
      "name": "Badge",
      "category": "B",
      "summary": "A Material Design \"badge\".",
      "docUrl": "https://api.flutter.devmaterial/Badge-class.html",
      "kind": "class"
    },
    {
      "id": "badgetheme",
      "name": "BadgeTheme",
      "category": "B",
      "summary": "An inherited widget that overrides the default color style, and size parameters for Badges in this widget's subtree.",
      "docUrl": "https://api.flutter.devmaterial/BadgeTheme-class.html",
      "kind": "class"
    },
    {
      "id": "badgethemedata",
      "name": "BadgeThemeData",
      "category": "B",
      "summary": "Overrides the default properties values for descendant Badge widgets.",
      "docUrl": "https://api.flutter.devmaterial/BadgeThemeData-class.html",
      "kind": "class"
    },
    {
      "id": "bottomappbar",
      "name": "BottomAppBar",
      "category": "B",
      "summary": "A container that is typically used with Scaffold.bottomNavigationBar.",
      "docUrl": "https://api.flutter.devmaterial/BottomAppBar-class.html",
      "kind": "class"
    },
    {
      "id": "bottomappbartheme",
      "name": "BottomAppBarTheme",
      "category": "B",
      "summary": "Defines default property values for descendant BottomAppBar widgets.",
      "docUrl": "https://api.flutter.devmaterial/BottomAppBarTheme-class.html",
      "kind": "class"
    },
    {
      "id": "bottomappbarthemedata",
      "name": "BottomAppBarThemeData",
      "category": "B",
      "summary": "Defines default property values for descendant BottomAppBar widgets.",
      "docUrl": "https://api.flutter.devmaterial/BottomAppBarThemeData-class.html",
      "kind": "class"
    },
    {
      "id": "bottomnavigationbar",
      "name": "BottomNavigationBar",
      "category": "B",
      "summary": "A material widget that's displayed at the bottom of an app for selecting among a small number of views, typically between three and five.",
      "docUrl": "https://api.flutter.devmaterial/BottomNavigationBar-class.html",
      "kind": "class"
    },
    {
      "id": "bottomnavigationbartheme",
      "name": "BottomNavigationBarTheme",
      "category": "B",
      "summary": "Applies a bottom navigation bar theme to descendant BottomNavigationBar widgets.",
      "docUrl": "https://api.flutter.devmaterial/BottomNavigationBarTheme-class.html",
      "kind": "class"
    },
    {
      "id": "bottomnavigationbarthemedata",
      "name": "BottomNavigationBarThemeData",
      "category": "B",
      "summary": "Defines default property values for descendant BottomNavigationBar widgets.",
      "docUrl": "https://api.flutter.devmaterial/BottomNavigationBarThemeData-class.html",
      "kind": "class"
    },
    {
      "id": "bottomsheet",
      "name": "BottomSheet",
      "category": "B",
      "summary": "A Material Design bottom sheet.",
      "docUrl": "https://api.flutter.devmaterial/BottomSheet-class.html",
      "kind": "class"
    },
    {
      "id": "bottomsheetthemedata",
      "name": "BottomSheetThemeData",
      "category": "B",
      "summary": "Defines default property values for BottomSheet's Material.",
      "docUrl": "https://api.flutter.devmaterial/BottomSheetThemeData-class.html",
      "kind": "class"
    },
    {
      "id": "buttonbar",
      "name": "ButtonBar",
      "category": "B",
      "summary": "An end-aligned row of buttons, laying out into a column if there is not enough horizontal space.",
      "docUrl": "https://api.flutter.devmaterial/ButtonBar-class.html",
      "kind": "class"
    },
    {
      "id": "buttonbartheme",
      "name": "ButtonBarTheme",
      "category": "B",
      "summary": "Applies a button bar theme to descendant ButtonBar widgets.",
      "docUrl": "https://api.flutter.devmaterial/ButtonBarTheme-class.html",
      "kind": "class"
    },
    {
      "id": "buttonbarthemedata",
      "name": "ButtonBarThemeData",
      "category": "B",
      "summary": "Defines the visual properties of ButtonBar widgets.",
      "docUrl": "https://api.flutter.devmaterial/ButtonBarThemeData-class.html",
      "kind": "class"
    },
    {
      "id": "buttonsegment",
      "name": "ButtonSegment",
      "category": "B",
      "summary": "Data describing a segment of a SegmentedButton.",
      "docUrl": "https://api.flutter.devmaterial/ButtonSegment-class.html",
      "kind": "class"
    },
    {
      "id": "buttonstyle",
      "name": "ButtonStyle",
      "category": "B",
      "summary": "The visual properties that most buttons have in common.",